Date,Title,Post Content,Image URL
2025-01-03,Beef Caldereta,"🍳 Today's Recipe: Beef Caldereta

0.	Heat oil in a cooking pot. Saute onion and garlic until onion softens
1.	Add beef. Saute until the outer part turns light brown.
2.	Add soy sauce...",https://www.themealdb.com/images/media/meals/41cxjh1683207682.jpg
2025-01-03,Beef Sunday Roast,"🍳 Today's Recipe: Beef Sunday Roast

Cook the Broccoli and Carrots in a pan of boiling water until tender.

Roast the Beef and Potatoes in the oven for 45mins, the potatoes may need to ...",https://www.themealdb.com/images/media/meals/ssrrrs1503664277.jpg
2025-01-03,Smoky Lentil Chili with Squash,"🍳 Today's Recipe: Smoky Lentil Chili with Squash

Begin by roasting the squash. Slice it into thin crescents and drizzle with a little oil and sprinkle with sea salt. I added a fresh little sage I had...",https://www.themealdb.com/images/media/meals/uwxqwy1483389553.jpg
2025-01-03,Boxty Breakfast,"🍳 Today's Recipe: Boxty Breakfast

STEP 1
Before you start, put your oven on its lowest setting, ready to keep things warm. Peel the potatoes, grate 2 of them, then set aside. Cut the ...",https://www.themealdb.com/images/media/meals/naqyel1608588563.jpg
2025-01-03,Summer Pudding,"🍳 Today's Recipe: Summer Pudding

Bring out the juices: Wash fruit and gently dry on kitchen paper – keep strawberries separate. Put sugar and 3 tbsp water into a large pan. Gently hea...",https://www.themealdb.com/images/media/meals/rsqwus1511640214.jpg
2025-01-03,Chocolate Gateau,"🍳 Today's Recipe: Chocolate Gateau

Preheat the oven to 180°C/350°F/Gas Mark 4. Grease and line the base of an 8 in round spring form cake tin with baking parchment
Break the chocolate ...",https://www.themealdb.com/images/media/meals/tqtywx1468317395.jpg
2025-01-03,Chicken Couscous,"🍳 Today's Recipe: Chicken Couscous

Heat the olive oil in a large frying pan and cook the onion for 1-2 mins just until softened. Add the chicken and fry for 7-10 mins until cooked throu...",https://www.themealdb.com/images/media/meals/qxytrx1511304021.jpg
2025-01-04,Fruit and Cream Cheese Breakfast Pastries,"Preheat oven to 400ºF (200ºC), and prepare two cookie sheets with parchment paper. In a bowl, mix cream cheese, sugar, and vanilla until fully combined. Lightly flour the surface and roll out puff pastry on top to flatten. Cut each sheet of puff pastry into 9 equal squares. On the top right and bottom left of the pastry, cut an L shape approximately ½ inch (1 cm) from the edge.
NOTE: This L shape should reach all the way down and across the square, however both L shapes should not meet at the ends. Your pastry should look like a picture frame with two corners still intact.
Take the upper right corner and fold down towards the inner bottom corner. You will now have a diamond shape.
Place 1 to 2 teaspoons of the cream cheese filling in the middle, then place berries on top.
Repeat with the remaining pastry squares and place them onto the parchment covered baking sheet.
Bake for 15-20 minutes or until pastry is golden brown and puffed.
Enjoy!
",https://www.themealdb.com/images/media/meals/1543774956.jpg,Yes
2025-01-04,Rosół (Polish Chicken Soup),"Add chicken to a large Dutch oven or stock pot 
Cover with water
Bring to a boil and simmer for 2 to 2 1/2 hours, skimming any impurities off the top to insure a clear broth
If your pot is big enough, add the vegetables and spices for the last hour of the cooking time
My Dutch oven wasn’t big enough to hold everything, just the chicken and other bones filled the pot, so I cooked the meat/bones for the full cooking time, then removed them, and cooked the vegetables and spices separately
Strain everything out of the broth
Bone the chicken, pulling the meat into large chunks
Slice the carrots
Return the chicken and carrots to the broth
Cook noodles according to package instructions if you’re using them
Add noodles to bowl and then top with hot soup",https://www.themealdb.com/images/media/meals/lx1kkj1593349302.jpg,Yes
2025-01-04,Jam Roly-Poly,"Put a deep roasting tin onto the bottom shelf of the oven, and make sure that there’s another shelf directly above it. Pull the roasting tin out on its shelf, fill two-thirds with boiling water from the kettle, then carefully slide it back in. Heat oven to 180C/160C fan/gas 4. Tear off a large sheet of foil and greaseproof paper (about 30 x 40cm). Sit the greaseproof on top of the foil and butter it.
Tip butter, flour and vanilla seeds into a food processor; pulse until the butter has disappeared. Tip into a mixing bowl. Stir through the suet, pour in the milk and work together with a cutlery knife until you get a sticky dough. You may need a drop more milk, depending on your flour.
Tip the dough out onto a floured surface, quickly pat together to smooth, then roll out to a square roughly 25 x 25cm. Spread the jam all over, leaving a gap along one edge, then roll up from the opposite edge. Pinch the jam-free edge into the dough where it meets, and pinch the ends roughly, too. Carefully lift onto the greased paper, join-side down (you might find a flat baking sheet helpful for this), loosely bring up the paper and foil around it, then scrunch together along the edges and ends to seal. The roly-poly will puff quite a bit during cooking so don’t wrap it tightly. Lift the parcel directly onto the rack above the tin and cook for 1 hr.
Let the pudding sit for 5 mins before unwrapping, then carefully open the foil and paper, and thickly slice to serve.",https://www.themealdb.com/images/media/meals/ysqupp1511640538.jpg,Yes
2025-01-04,Oxtail with broad beans,"Toss the oxtail with the onion, spring onion, garlic, ginger, chilli, soy sauce, thyme, salt and pepper. Heat the vegetable oil in a large frying pan over medium-high heat. Brown the oxtail in the pan until browned all over, about 10 minutes. Place into a pressure cooker, and pour in 375ml water. Cook at pressure for 25 minutes, then remove from heat, and remove the lid according to manufacturer's directions.
Add the broad beans and pimento berries, and bring to a simmer over medium-high heat. Dissolve the cornflour in 2 tablespoons water, and stir into the simmering oxtail. Cook and stir a few minutes until the sauce has thickened, and the broad beans are tender.",https://www.themealdb.com/images/media/meals/1520083578.jpg,Yes
2025-01-04,Peanut Butter Cookies,"Preheat oven to 350ºF (180ºC).
In a large bowl, mix together the peanut butter, sugar, and egg.
Scoop out a spoonful of dough and roll it into a ball. Place the cookie balls onto a nonstick baking sheet.
For extra decoration and to make them cook more evenly, flatten the cookie balls by pressing a fork down on top of them, then press it down again at a 90º angle to make a criss-cross pattern.
Bake for 8-10 minutes or until the bottom of the cookies are golden brown.
Remove from baking sheet and cool.
Enjoy!",https://www.themealdb.com/images/media/meals/1544384070.jpg,Yes
2025-01-04,Tarte Tatin,"Roll the pastry to a 3mm-thick round on a lightly floured surface and cut a 24cm circle, using a plate as a guide. Lightly prick all over with a fork, wrap in cling film on a baking sheet and freeze while preparing the apples.
Heat oven to 180C/160C fan/gas 4. Peel, quarter and core the apples. Put the sugar in a flameproof 20cm ceramic Tatin dish or a 20cm ovenproof heavy-based frying pan and place over a medium-high heat. Cook the sugar for 5-7 mins to a dark amber caramel syrup that’s starting to smoke, then turn off the heat and stir in the 60g diced chilled butter.
To assemble the Tarte Tatin, arrange the apple quarters very tightly in a circle around the edge of the dish first, rounded-side down, then fill in the middle in a similar fashion. Gently press with your hands to ensure there are no gaps. Brush the fruit with the melted butter.
Bake in the oven for 30 mins, then remove and place the disc of frozen puff pastry on top – it will quickly defrost. Tuck the edges down the inside of the dish and, with a knife, prick a few holes in the pastry to allow steam to escape. Bake for a further 40-45 mins until the pastry is golden brown and crisp.
Allow to cool to room temperature for 1 hr before running a knife around the edge of the dish and inverting it onto a large serving plate that is deep enough to contain the juices. Serve with crème fraîche or vanilla ice cream.",https://www.themealdb.com/images/media/meals/ryspuw1511786688.jpg,Yes
2025-01-04,Beef Asado,"0.	Combine beef, crushed peppercorn, soy sauce, vinegar, dried bay leaves, lemon, and tomato sauce. Mix well. Marinate beef for at least 30 minutes.
1.	Put the marinated beef in a cooking pot along with remaining marinade. Add water. Let boil.
2.	Add Knorr Beef Cube. Stir. Cover the pot and cook for 40 minutes in low heat.
3.	Turn the beef over. Add tomato paste. Continue cooking until beef tenderizes. Set aside.
4.	Heat oil in a pan. Fry the potato until it browns. Turn over and continue frying the opposite side. Remove from the pan and place on a clean plate. Do the same with the carrots.
5.	Save 3 tablespoons of cooking oil from the pan where the potato was fried. Saute onion and garlic until onion softens.
6.	Pour-in the sauce from the beef stew. Let boil. Add the beef. Cook for 2 minutes.
7.	Add butter and let it melt. Continue cooking until the sauce reduces to half.",https://www.themealdb.com/images/media/meals/pkopc31683207947.jpg,Yes
2025-01-04,Nasi lemak,"In a medium saucepan over medium heat, stir together coconut milk, water, ground ginger, ginger root, salt, bay leaf, and rice. Cover, and bring to a boil. Reduce heat, and simmer for 20 to 30 minutes, or until done.

 Step 2
Place eggs in a saucepan, and cover with cold water. Bring water to a boil, and immediately remove from heat. Cover, and let eggs stand in hot water for 10 to 12 minutes. Remove eggs from hot water, cool, peel and slice in half. Slice cucumber.

 Step 3
Meanwhile, in a large skillet or wok, heat 1 cup vegetable oil over medium-high heat. Stir in peanuts and cook briefly, until lightly browned. Remove peanuts with a slotted spoon and place on paper towels to soak up excess grease. Return skillet to stove. Stir in the contents of one package anchovies; cook briefly, turning, until crisp. Remove with a slotted spoon and place on paper towels. Discard oil. Wipe out skillet.

 Step 4
Heat 2 tablespoons oil in the skillet. Stir in the onion, garlic, and shallots; cook until fragrant, about 1 or 2 minutes. Mix in the chile paste, and cook for 10 minutes, stirring occasionally. If the chile paste is too dry, add a small amount of water. Stir in remaining anchovies; cook for 5 minutes. Stir in salt, sugar, and tamarind juice; simmer until sauce is thick, about 5 minutes.

 Step 5
Serve the onion and garlic sauce over the warm rice, and top with peanuts, fried anchovies, cucumbers, and eggs.",https://www.themealdb.com/images/media/meals/wai9bw1619788844.jpg,Yes
2025-01-04,Sugar Pie,"Preheat oven to 350 degrees F (175 degrees C). Grease a 9-inch pie dish.
Place the brown sugar and butter in a mixing bowl, and beat them together with an electric mixer until creamy and very well combined, without lumps. Beat in eggs, one at a time, incorporating the first egg before adding the next one. Add the vanilla extract and salt; beat the flour in, a little at a time, and then the milk, making a creamy batter. Pour the batter into the prepared pie dish.
Bake in the preheated oven for 35 minutes; remove pie, and cover the rim with aluminum foil to prevent burning. Return to oven, and bake until the middle sets and the top forms a crusty layer, about 15 more minutes. Let the pie cool to room temperature, then refrigerate for at least 1 hour before serving.",https://www.themealdb.com/images/media/meals/yrstur1511816601.jpg,Yes
2025-01-04,Rock Cakes,"Preheat oven to 180C/350F/Gas 4 and line a baking tray with baking parchment.
Mix the flour, sugar and baking powder in a bowl and rub in the cubed butter until the mixture looks like breadcrumbs, then mix in the dried fruit.
In a clean bowl, beat the egg and milk together with the vanilla extract.
Add the egg mixture to the dry ingredients and stir with a spoon until the mixture just comes together as a thick, lumpy dough. Add a teaspoon more milk if you really need it to make the mixture stick together.
Place golfball-sized spoons of the mixture onto the prepared baking tray. Leave space between them as they will flatten and spread out to double their size during baking.
Bake for 15-20 minutes, until golden-brown. Remove from the oven, allow to cool for a couple of minutes then turn them out onto a wire rack to cool.",https://www.themealdb.com/images/media/meals/tqrrsq1511723764.jpg,Yes
2025-01-04,Spicy Arrabiata Penne,"Bring a large pot of water to a boil. Add kosher salt to the boiling water, then add the pasta. Cook according to the package instructions, about 9 minutes.
In a large skillet over medium-high heat, add the olive oil and heat until the oil starts to shimmer. Add the garlic and cook, stirring, until fragrant, 1 to 2 minutes. Add the chopped tomatoes, red chile flakes, Italian seasoning and salt and pepper to taste. Bring to a boil and cook for 5 minutes. Remove from the heat and add the chopped basil.
Drain the pasta and add it to the sauce. Garnish with Parmigiano-Reggiano flakes and more basil and serve warm.",https://www.themealdb.com/images/media/meals/ustsqw1468250014.jpg,Yes
2025-01-04,Spanish Tortilla,"Put a large non-stick frying pan on a low heat. Cook the onion slowly in the oil and butter until soft but not brown – this should take about 15 mins. Add the potatoes, cover the pan and cook for a further 15-20 mins, stirring occasionally to make sure they fry evenly.
When the potatoes are soft and the onion is shiny, crush 2 garlic cloves and stir in, followed by the beaten eggs.
Put the lid back on the pan and leave the tortilla to cook gently. After 20 mins, the edges and base should be golden, the top set but the middle still a little wobbly. To turn it over, slide it onto a plate and put another plate on top, turn the whole thing over and slide it back into the pan to finish cooking. Once cooked, transfer to a plate and serve the tortilla warm or cold, scattered with the chopped parsley.
To accompany, take slices of warmed baguette, stab all over with a fork and rub with the remaining garlic, pile on grated tomatoes and season with sea salt and a drizzle of olive oil.",https://www.themealdb.com/images/media/meals/quuxsx1511476154.jpg,Yes
2025-01-04,Ma Po Tofu,"Add a small pinch of salt and sesame oil to minced beef. Mix well and set aside.
Mix 1 tablespoon of cornstarch with 2 and ½ tablespoons of water in a small bowl to make water starch.
Cut tofu into square cubes (around 2cms). Bring a large amount of water to a boil and then add a pinch of salt. Slide the tofu in and cook for 1 minute. Move out and drain.
Get a wok and heat up around 2 tablespoons of oil, fry the minced meat until crispy. Transfer out beef out and leave the oil in.
Fry doubanjiang for 1 minute over slow fire and then add garlic, scallion white, ginger and fermented black beans to cook for 30 seconds until aroma. Then mix pepper flakes in.
Add water to the seasonings and bring to boil over high fire. Gently slide the tofu cubes. Add light soy sauce and beef.Slow the heat after boiling and then simmer for 6-8 minutes. Then add chopped garlic greens.
Stir the water starch and then pour half of the mixture to the simmering pot. Wait for around 30 seconds and then pour the other half. You can slightly taste the tofu and add pinch of salt if not salty enough. By the way, if you feel it is too spicy, add some sugar can milder the taste. But be carefully as the broth is very hot at this point.
Transfer out when almost all the seasonings stick to tofu cubes. Sprinkle Szechuan peppercorn powder (to taste)and chopped garlic greens if using.
Serve immediately with steamed rice.",https://www.themealdb.com/images/media/meals/1525874812.jpg,Yes
