2025-01-03,Squash linguine,"Heat oven to 200C/180C fan/gas 6. Put the squash and garlic on a baking tray and drizzle with the olive oil. Roast for 35-40 mins until soft. Season.
Cook the pasta according to pack instructions. Dr",https://www.themealdb.com/images/media/meals/wxswxy1511452625.jpg
2025-01-03,Fennel Dauphinoise,"Heat oven to 180C/160C fan/gas 4. Put potatoes, fennel, and garlic in a medium non-stick pan. Pour in milk and double cream, season well and simmer gently, covered, for 10 mins, stirring halfway throu",https://www.themealdb.com/images/media/meals/ytttsv1511798734.jpg
2025-01-03,Grilled Portuguese sardines,"STEP 1

Put all of the ingredients, except the sardines, into a bowl and mix together with some seasoning. Pour into a baking dish, add the sardines and toss really well. Cover and chill for a few h",https://www.themealdb.com/images/media/meals/lpd4wy1614347943.jpg
2025-01-03,Japanese gohan rice,"STEP 1
Rinsing and soaking your rice is key to achieving the perfect texture. Measure the rice into a bowl, cover with cold water, then use your fingers to massage the grains of rice – the water will",https://www.themealdb.com/images/media/meals/kw92t41604181871.jpg
2025-01-03,Kung Pao Chicken,"Combine the sake or rice wine, soy sauce, sesame oil and cornflour dissolved in water. Divide mixture in half.
In a glass dish or bowl, combine half of the sake mixture with the chicken pieces and to",https://www.themealdb.com/images/media/meals/1525872624.jpg
2025-01-03,Chicken Quinoa Greek Salad,"Cook the quinoa following the pack instructions, then rinse in cold water and drain thoroughly.

Meanwhile, mix the butter, chilli and garlic into a paste. Toss the chicken fillets in 2 tsp of the o",https://www.themealdb.com/images/media/meals/k29viq1585565980.jpg
2025-01-03,Beef Mechado,"0.	Make the beef tenderloin marinade by combining soy sauce, vinegar, ginger, garlic, sesame oil, olive oil, sugar, salt, and ground black pepper in a large bowl. Mix well.
1.	Add the cubed beef tend",https://www.themealdb.com/images/media/meals/cgl60b1683206581.jpg
